Date,Article Name,Article Source,Key Phrases,Summary
2026-06-24 05:46,Nordex Gets 112 MW Order From NeXtWind For Wind Farm In Saxony-Anhalt In Germany - TradingView,https://news.google.com/rss/articles/CBMi5AFBVV95cUxNMVZTUlRGOUdyTVJiZWJLR2t6MjQtZ213MVo4TzF1czVuSTFoN1lWb0Mzc0J0R1B6WnhOdWItNkxrUUxaWnBoMnlWN3gtaVRzZGlnZ015XzVETmtmZHZZeE9XSFJrNURpZTVqbVFZbWZZeXpPQURQZVpsOTE0ZzUtMGdJZGZLckt0ZWZTRVgzX1RqaHBRdHVhOXV1TnVNcmpmTnlyRGtHMVRzRnA5cnBKQjYzeENHVHFmd2g1R1BYY29UWWpUa3ZDcEFrT1E1QnRVaVNQNm1pRzdYS0xzV0RkSFRWdkk?oc=5,"order, MW",Nordex Gets 112 MW Order From NeXtWind For Wind Farm In Saxony-Anhalt In Germany TradingView
2026-06-24 09:46,Vestas Secures 40 MW Wind Turbine Order for Reken Hülsterholt Project in Germany - WindInsider,https://news.google.com/rss/articles/CBMivAFBVV95cUxNcmFrWWxGRE1leXd2MTQ0ejFYYTBnRml2Y053b0NpRk42Q2VkSVRQcFVjWEhVUFphcXprZUc5LS1nRnZsX0U4Vkd6aE43UTdqcDRSelc5eW90MlRoOWZFRXpST2ZaV0JVMC1VNFVnY2dqM3YzUUJ1WWdRSHFEcVJBeUlNVXhZUE5wLTZyQzFnemlzaERZeHBHYnZBSUZUV25GRmR2M2l3RXhaYWpBNmo5ZWhpR0kwTHVya0pIb9IBvAFBVV95cUxNcmFrWWxGRE1leXd2MTQ0ejFYYTBnRml2Y053b0NpRk42Q2VkSVRQcFVjWEhVUFphcXprZUc5LS1nRnZsX0U4Vkd6aE43UTdqcDRSelc5eW90MlRoOWZFRXpST2ZaV0JVMC1VNFVnY2dqM3YzUUJ1WWdRSHFEcVJBeUlNVXhZUE5wLTZyQzFnemlzaERZeHBHYnZBSUZUV25GRmR2M2l3RXhaYWpBNmo5ZWhpR0kwTHVya0pIbw?oc=5,"order, MW, turbine",Vestas Secures 40 MW Wind Turbine Order for Reken Hülsterholt Project in Germany WindInsider
2026-06-24 11:01,‘Nobody wants it': Residents give verdict on offshore windfarm plans at event - Isle of Man Today,https://news.google.com/rss/articles/CBMiswFBVV95cUxNRjNoLU1laTF1TTRZYWtVUS1VNEVSZ1U2UmUyU3JrbXIwNS00bURnM0tmSGdqbmZCd3pmWnIwa3BzYXBSWVlkbmRBMzlSS2RWQllTU3Z3c2JHeEtjVTlJMWRNZ2hxVXE0MjFYb0Voc0hkcS1OWGV2UWppeGJwNV9uQUVqVl9yOExNT05Ea1lIM3MxdGxOOUxtajNhak95dGNzWkpQQUd0QTJVdEQ4SzQ5UjJvQQ?oc=5,offshore,‘Nobody wants it': Residents give verdict on offshore windfarm plans at event Isle of Man Today
2026-06-24 05:07,Hornsea 2 offshore wind farm from Ørsted A/ S - 1.3 GW feeding millions of UK homes - Ad-hoc-news.de,https://news.google.com/rss/articles/CBMiywFBVV95cUxQcFRieE84Uk1kWlcxVDlmMDhMM015ZkxMbTk4Y0ZWYmVIV2N3TTlWcUNCc0drTnpaOGljT01PMG1PQ1pWQ0JtUl9ITUpnbFljc1BaekctWkNhWDhSNTZKNU5sb2lkQWdseEwzZDhYNkFnX0lrRE80ZHRxcWFkNXdBeTRHWGxHdnMwVmJFcEt0dG5yVzgxVl8wS0x1ZGo2TjA3TE5reG5YNnBCSVQ4NlJtRXFRUEgtX3Q5djdkd1NVWkxKSDJTejJPT0lpTQ?oc=5,"GW, offshore",Hornsea 2 offshore wind farm from Ørsted A/ S - 1.3 GW feeding millions of UK homes Ad-hoc-news.de
2026-06-24 10:08,RWE to Become Majority Shareholder in Amprion After €4.1B Deal - Offshore Engineer Magazine,https://news.google.com/rss/articles/CBMipgFBVV95cUxNLWZLclcxaDlZakJ3TXFZZ05xanNUOHBVS1JJQk5RNUR0cHRXcTRsaFVGU1NBVENDalFLcGNSSkZKZ2tTNE5MYUNzQmFkUktxSUtqNW91eUwxMFZsZWI5amxnaEU1UEVVTU43UjdJWXBPUk1xdEt3SlJrMlJtYTNYRlEySDhQb2RteXpnQlVoRDBGSllUZUtpNDdjbEJoeUw5VEZpYjR3?oc=5,offshore,RWE to Become Majority Shareholder in Amprion After €4.1B Deal Offshore Engineer Magazine
2026-06-24 11:24,Nordex Secures 112 MW Wind Order from NeXtWind for Major Repowering Project in Germany - WindInsider,https://news.google.com/rss/articles/CBMivwFBVV95cUxQNC1SMnZObjhjcmZFTmR1aVIydkpxYXFXM1BDTDNncXREVHc3MXJ3SWtnZzJvbTlPMUJLUmFnUllGcmpkUlc4NGI2ckY2NEVOTXdQVnU1TWtxLXQ2OVdWdWFxQzlNSmRUWkwyY2RKWUxGMWx5d2dvTUgtdVBhbDV4RlVIb3NGUDRIYmpJc25rMWVZSldEejRUV3JRUWRIbEhia3pReTRUa0dwT2ZPNE1LRjJyaU9OZzF5ZjdrUkowVdIBxAFBVV95cUxQd3ZaTm1DM2ZOeGhjTFNrUXpfbGhwNGVGNmV2cTNIeVBILWdvWFptRFVPUXkwaFNHdERTbUJvNDllWUFWa2Y0RlU1MThqSE9TNlNpRnktRy1yc3MtLXBvTlBrY1haQlo5TEl3Nzh2VFB6SWFxN1dFNzRZR2JEVVBTY2VCTTV3Zi00dlhIMmFFZ2NaOXlHUExFWm9pTXZFU3Jhdkh1MG9fSjRoSWdVN2Y3TVlWWXZfOWFiU0JGYnYwcU1VRVFT?oc=5,"order, MW, repowering",Nordex Secures 112 MW Wind Order from NeXtWind for Major Repowering Project in Germany WindInsider
2026-06-24 11:00,California threatens legal action over offshore wind lease buyout - TGS 4C Offshore,https://news.google.com/rss/articles/CBMisAFBVV95cUxPTHgzNHdWajZyUUVvcTctRzlfZGVCVVhzWGhDLTZ0NW5WRk9HTHlaaks2MDNKandaRFBuR2ozczgzdTlvM0NOakE3Z1RmZjN4b1g1RzJrTG9CeUR2WnRZSHhaNTlsWWlRb2VRLVQtYmF1cFNfNTBtYWo5Y3liZjF1b0JiVGl2WGk0VGtCbUwtRFlWb2U1cFk1SUxydzFyOHpwaG5Mdlk1WTFtUS1BMk1sZA?oc=5,offshore,California threatens legal action over offshore wind lease buyout TGS 4C Offshore
2026-06-24 08:35,Turkey reveals offshore tender plan with return option for developers - Recharge News,https://news.google.com/rss/articles/CBMiuwFBVV95cUxPeWpYTFAybTJENEFkY08tUnNuSTM0eGg2MVI5UXNLV2I0MXJpUHNWbjRyRkJudFdibk5kemRqLTNzSVNtMm9rSVdUU1hxN1JuN2pSbFBDVW1TcGMtNlAtbThnazlLNFRMS2FvaFVSeS0xZ19rOW9pWGhHQ3BWS0tCMmt5LVBVU2x0U253Nl9UUFBucjZxeTZhVnpVVUxjNUhjLUxDRGtXR3k0Wnc3ZW1TSVFzNVNfTFJsR0tz?oc=5,offshore,Turkey reveals offshore tender plan with return option for developers Recharge News
2026-06-24 10:50,DeepOcean completes inter-array cable installation at Nordseecluster A - TGS 4C Offshore,https://news.google.com/rss/articles/CBMitwFBVV95cUxNRlhUbFdGZE1Jb0tfZzktRW1iYzFVOGFVcUFfSUljUnRfYkQ0dHVwLV9QZS0xZXQ1S05MZjhUcEdQSUo5QnJkUXREeVlULUdkY3c0cTdObVpfV0YtSFU3dUl5ZjZsVUlLSHB5UDQ4bC1VRUlmSHFXUF9ONUdteDdiakFkN1hhSFNqMEM1MWVLTDJZU1poVlNQN0Y2SmhlU19zb2dReHlOZVZwUjZ3bXdzZGJoaWZPalE?oc=5,offshore,DeepOcean completes inter-array cable installation at Nordseecluster A TGS 4C Offshore
2026-06-24 12:15,"Solaria and Iberdrola dominate the June BOE: more than 4,226 MW are progressing between solar, wind and storage - Energía Estratégica",https://news.google.com/rss/articles/CBMirAFBVV95cUxOQmVPWjNNSEJzNVVId2x0SGlFWHlQalgtbkw0aDlOM2I0dWNvOEtjUXBmN1NrR1ltblNiUkVqdnpJbXlzR2pwSWNmYjlfLTZHVGwtMW5uTVlvTkFVYVZOVzVIUDNMZzhCM0MwOVlTVVhOX0tvVVBReVZFUWM3bDR6Tjk5UDVjenZpT05VNXc5WkdBVWw5X3BWSzZoU19mWnFtNlB4MVJtSkxncUJr?oc=5,MW,"Solaria and Iberdrola dominate the June BOE: more than 4,226 MW are progressing between solar, wind and storage Energía Estratégica"
2026-06-24 05:50,"Iberdrola focuses on offshore wind strategy, shares supported by steady earnings outlook - Ad-hoc-news.de",https://news.google.com/rss/articles/CBMiyAFBVV95cUxPQ0dyUDRlQlp2WEQxYnh5eE9OME82Q05WZ3JGLVd1S1lTWGU0THAwQXNxX0VNX2theGJqendOYVFoLU5TdU9ydlozeWlYTWJkbEk5VzJMSEswajhhSlRvSHJKN2NGNXNFdHloWmRraUF2UEZBaDRCanZMOVhIdVJEUzBJaGpmMThaM0lIbi1WY3ZubnA5alo1SXdTdGRNSUR1YkI3SmZ6NzlFaGtHRzR3b1AxVDhqTHpVNGxZTy1VMmdycGY2eUdSRA?oc=5,offshore,"Iberdrola focuses on offshore wind strategy, shares supported by steady earnings outlook Ad-hoc-news.de"
2026-06-24 02:21,The Vineyard Wind 1 from Iberdrola S.A. - 800 MW offshore project reshapes New England’s grid - Ad-hoc-news.de,https://news.google.com/rss/articles/CBMiygFBVV95cUxNdHR1Y3RaQWhwUl9iNHFqNVdIbmk2NGJGMVBkQU1iU1JReDVTUnZrZkpDdVE4d19qMnptNklBNjdTWGU2dnQycW5YbDZDVVAzSWhkeV80UVRwcDdtdE1aRzNjZ29HX0xfMlkzZ0hQWUxFalU5cTkzT3Z3eGZZRi1wT1Zjc2lFNWRBMDZ0MnBBeDRaRmdST0RjbS1vd25aQ1dDSzZpSnJOQmxXcVRhbFg5bHdrYmtrR3l5WnU1NkZBc0t3bTdZTjdWTGl3?oc=5,"MW, offshore",The Vineyard Wind 1 from Iberdrola S.A. - 800 MW offshore project reshapes New England’s grid Ad-hoc-news.de
2026-06-24 04:03,The Bronco II wind portfolio from NextEra Energy Partners LP - steady 380 MW in the Texas plains - Ad-hoc-news.de,https://news.google.com/rss/articles/CBMiygFBVV95cUxNRUZWMDlDVVRGcU1QWjZxcHpqSkQ0QnZTMExZYjlFVFQzWUZpNUhWdzdUaENBR1ZQOUs3anZnOG9qRkJYRURsMXpaS083Z3drNENzS2VVNU4zT04tRjRENk9lZUxPdUlnM1FPN2didnl6aDNBQ1REUDJpU0RHSEVGdEZkUTRpZUFjTGF2OVJoTXl1NEc0eDM0NjlTRWplcUk3MVp6bU84VldZSThJWENjTkRuci0tYVU2NWwyblJXaXIxaVl5OUZHc25n?oc=5,MW,The Bronco II wind portfolio from NextEra Energy Partners LP - steady 380 MW in the Texas plains Ad-hoc-news.de
2026-06-24 11:54,"SSE, Equinor launch Dogger D onshore consultation - reNEWS",https://news.google.com/rss/articles/CBMijwFBVV95cUxNbV9vV0t6a1liZS1yUExpRTZWc0VJMnU4LW8xVFJnenV0VnhyY1NnSEJLeGg2MzN5eVlEcDRkQXZFblljblFrb2tlazZvbFJKcFkxa1JfdFZxeUdjOXpvbHVhS0M3X281c2FyX3lXdkg2RlhxN0ZFcnFiaHE2NWoxbjZpc1FFWlMzWHRGQXBRdw?oc=5,onshore,"SSE, Equinor launch Dogger D onshore consultation reNEWS"
2026-06-24 10:26,US offshore wind left adrift as Trump buys back leases - Maritime Journal,https://news.google.com/rss/articles/CBMitAFBVV95cUxOekdGaFJ5NjExeF8wVXZxc1JrcXFTOHAtZ0YtdnhHZG5PeVNfVWdaMTg3c1AyUERxSjRCQmpYeTNnTnFpUDRZbTBzbnJfX3VNbXBKRERER2xManVHcVZhNXdmTE5DeGV3UkI0aDZTbXQ3c2V1Mk9yaU9aankydEU2RlJSblZiMTl0MDBFc0x6ek14VFo0TTJDT0lWWHY4WFJ4M2g2RG1RTklkQmxabV9PZlE1Sm4?oc=5,offshore,US offshore wind left adrift as Trump buys back leases Maritime Journal
2026-06-24 15:36,"World Blade Root Fittings for Turbines - Market Analysis, Forecast, Size, Trends and Insights - IndexBox",https://news.google.com/rss/articles/CBMigAJBVV95cUxON2NOd21NX3hJU1h4VkktckV2VnlSbFVzSGcwcG82SjdvdnZ2NFF1SEk1VUJ2ZkpSZkg3SEtzNGpNTFg4Q3IwTmFLZHVqazVKWk1wdHlueUF1aW5FUlFsLTltTDBScElWNlZaTEFQbHJsZWxiS2c3TVNWakprRGFUSFBoeG1UNGhaM0xxRVBOaExUb3FVcFFfOTRoMUdITXFRY2U5RzNNYW1GSXozbFdTTWpSRk9pLU1RM2pUaVhMczlwNHBhaDZyam4tZDhVblFBMU90UkVLTERWMXgwbFVYYVNnNHBqQjJlWlVzUEhNcjZGYzM2ajhWMDhIUjhnellT?oc=5,blade,"World Blade Root Fittings for Turbines - Market Analysis, Forecast, Size, Trends and Insights IndexBox"
2026-06-25 06:59,Juniper Green Energy Commissions India’s Largest Wind Turbine with 5 MW Capacity and 181 m Rotor Diameter - WindInsider,https://news.google.com/rss/articles/CBMi3AFBVV95cUxOeWZpQWI2SGE4LTY0QXV4bXJVa0RvQVdpRGtIVjBqTzJzOEhGWnhkTmpRTlZ0VktVRUlPbmFDQUk0WE1DLVZoal9OeXRyVWxJQVZRd0JwMVkwbVM1SDVxTkphbmQybWpBSVZWNUFRbWotMDFUMWxrQmROWGg1V3RPdDdxX2YtUTlXQmx5TDRwZDVFWW4xNlpjRF8xLXlIS29qT0hhdV9PU2toSjlSWUxhLTk2dWF3ZDJMYjBVc3RfVVV6YzdZRzF4R3RfNW4tOGRraHNOUjQ3V3Bad2hp0gHcAUFVX3lxTE55ZmlBYjZIYTgtNjRBdXhtclVrRG9BV2lEa0hWMGpPMnM4SEZaeGROalFOVnRWS1VFSU9uYUNBSTRYTUMtVmhqX055dHJVbElBVlF3QnAxWTBtUzVINXFOSmFuZDJtakFJVlY1QVFtai0wMVQxbGtCZE5YaDVXdE90N3FfZi1ROVdCbHlMNHBkNUVZbjE2WmNEXzEteUhLb2pPSGF1X09Ta2hKOVJZTGEtOTZ1YXdkMkxiMFVzdF9VVXpjN1lHMXhHdF81bi04ZGtoc05SNDdXcFp3aGk?oc=5,"MW, turbine",Juniper Green Energy Commissions India’s Largest Wind Turbine with 5 MW Capacity and 181 m Rotor Diameter WindInsider
2026-06-25 10:27,"Suzlon Secures 400 MW EPC Wind Project from Tata Power, Crosses 1 GW Partnership Milestone - WindInsider",https://news.google.com/rss/articles/CBMiyAFBVV95cUxPRmUtbUgwemZpTXo3eDhVamg1VERBbzhseE5FVzlTUFd6UFhoOElkTVp4ZmtDRFZYRl94UWhMaGFrQTQxWWxJUlZvY2pKVUlNcGZWX09uLUk5c2gzTzE4TFZuQXdLdVdTdmQzY3VsMVlESDhLandDMXFKbFlESmtuUzVHUUVlR25yQ3B5MmMzWTFySlZEU2R6X3o3SUxzMHFFR1dqQXRJRXNXeENQUnk1TjVmQ3RxdWVxTmdmcmYzTThnVW9nZFRCb9IByAFBVV95cUxPRmUtbUgwemZpTXo3eDhVamg1VERBbzhseE5FVzlTUFd6UFhoOElkTVp4ZmtDRFZYRl94UWhMaGFrQTQxWWxJUlZvY2pKVUlNcGZWX09uLUk5c2gzTzE4TFZuQXdLdVdTdmQzY3VsMVlESDhLandDMXFKbFlESmtuUzVHUUVlR25yQ3B5MmMzWTFySlZEU2R6X3o3SUxzMHFFR1dqQXRJRXNXeENQUnk1TjVmQ3RxdWVxTmdmcmYzTThnVW9nZFRCbw?oc=5,"MW, GW, partnership","Suzlon Secures 400 MW EPC Wind Project from Tata Power, Crosses 1 GW Partnership Milestone WindInsider"
2026-06-25 07:18,Hitachi Energy awarded contract for converter stations of 600 MW Italy–Tunisia interconnection - Windtech International,https://news.google.com/rss/articles/CBMi7AFBVV95cUxNaXQ5OC1ia0hyVHo1OXpKUC14YnMwRkRGY2JObjJ5UlFsdVVUdDh5REpnWUxmd2lDa2RTSFhtelpRWWo5T2ExS2EzeTVYMkFPa2trMUFDUXRERi03UUVIcWFqVXBSWlZobm12YkxBV3lmVUdKLWI1TlB0Z2hlQW5BazdUQVFtWnpGT3ZSV0xiUGlLTWVJSmt2ZGJIS21nMzRhVHpoOU1RTWlWR2VUZ3duTFA2eS1JMWlaYlFOLVA3d0ZCZUxyZXFzM3Q3LW5fVFBhM095bGk3dGlrejhWUnA5dUVTZVRQR0o0YlpQcA?oc=5,"MW, contract",Hitachi Energy awarded contract for converter stations of 600 MW Italy–Tunisia interconnection Windtech International
2026-06-25 03:54,AI Data Centers Are Driving a Power Supercycle. GE Vernova’s Gas Turbine Prices Are Up 300% in Three Years - AOL.com,https://news.google.com/rss/articles/CBMifkFVX3lxTE5vRXFESW9XbS0zNVdrOVZXQ0pPdWcwVTVTajZ2QXB6Sjdlai1mMEZnV0VDQzBaQ01lSXNUcGRhUWd2cDBObW5fX1N4NnJESXRKM3B1dndWdEtwUjJCbXVmblBTWG0zWmczUDJuYzFYTmE3c1dLSldXelBOQlIzQQ?oc=5,turbine,AI Data Centers Are Driving a Power Supercycle. GE Vernova’s Gas Turbine Prices Are Up 300% in Three Years AOL.com
2026-06-25 14:03,Türkiye Releases Draft Rules for Offshore Wind Tender: 49-Year Concession for 1 GW Project - offshoreWIND.biz,https://news.google.com/rss/articles/CBMiygFBVV95cUxNS1ZyaWZzdWd0T0tkS2xYaUJDVU82VGh0U01JVnFRb1dxWWR4YThBMEtWV3pxcndqeFU3NzQ3NUwyYTZSRG1nN094LXhJeWd3anN1TDY1V2QzMVJ2WEJrSVY3Q25fZ3pUVmt1T1E3WVlhbHY4WEl2TnNNc25tOU4yajY5RGp0TTFwX1BaeXhmdGFSaTR4YWVwenNEWmdXNldqZk5YRFJBWTVzM0xaaF9CWUZzc2RXTHgwbFBFNUdmMmJjeFpYMFdSSEln?oc=5,"GW, offshore",Türkiye Releases Draft Rules for Offshore Wind Tender: 49-Year Concession for 1 GW Project offshoreWIND.biz
2026-06-25 06:59,Juniper Green Energy Commissions India’s Largest Wind Turbine with 5 MW Capacity and 181 m Rotor Diameter - WindInsider,https://news.google.com/rss/articles/CBMi1wFBVV95cUxNN0ppWnFhdjE2RDBfQ3NZUHExUWF5cml5ekNmX1AzVUZtaXo1WVJzSjVjZ1djLTRMS1J2eGxRdWwydVRUYlEycm9WVHNlLW1RZ3R6Z3ZhNll3Ty0xbHdvQkM4bWkzVWZqcmdhQTZ6VTdtS2tITzlubXM1RTZWeWRJU3RDSTQwZWlyYTR4U2tGS2c2VlNXVlpoeTlfTmhSd1BZNWJfcFB6VVRiNVVJbGVwWEdhTDd5cWt0X213LW1POGFJc3EwZ3JFdV9JaWFvRXJ6dm9CNFFqa9IB3AFBVV95cUxOeWZpQWI2SGE4LTY0QXV4bXJVa0RvQVdpRGtIVjBqTzJzOEhGWnhkTmpRTlZ0VktVRUlPbmFDQUk0WE1DLVZoal9OeXRyVWxJQVZRd0JwMVkwbVM1SDVxTkphbmQybWpBSVZWNUFRbWotMDFUMWxrQmROWGg1V3RPdDdxX2YtUTlXQmx5TDRwZDVFWW4xNlpjRF8xLXlIS29qT0hhdV9PU2toSjlSWUxhLTk2dWF3ZDJMYjBVc3RfVVV6YzdZRzF4R3RfNW4tOGRraHNOUjQ3V3Bad2hp?oc=5,"MW, turbine",Juniper Green Energy Commissions India’s Largest Wind Turbine with 5 MW Capacity and 181 m Rotor Diameter WindInsider
2026-06-25 04:52,Vivant unit buys 200-MW Philippine wind project from Envision - Renewables Now,https://news.google.com/rss/articles/CBMiowFBVV95cUxPaERyVklubDlHQWdITE9HSEtTX05ncFZxM0NNNVo1UXIycTJaUTljRjJhM0dKMXMwamxvMFdidUNsMXg4MVRLUzNfQUpPeG9hVU5Fekk3M1UxdTF6dndTWWZTLUdqRndHdjJ3UVZteVR4ZTRza1BhbTVvSEhESWdVYWV1dlFfbzFJRjNUbnRwd3BHVGc5bDdWUTdoLTJPS0NCZzlV?oc=5,MW,Vivant unit buys 200-MW Philippine wind project from Envision Renewables Now
2026-06-25 11:08,Energy firm acquires 200-MW wind project - SunStar Publishing Inc.,https://news.google.com/rss/articles/CBMiigFBVV95cUxQODViZ2loNnFQa1FLbG5EUnhRZTBNVmJRZl9OcjdKenpRYzU2QTJ5YWlqcElQVGM0VXpFekJHUHZTNW1qd0dlSGh6am83aXZXNW9pOFdsNWs5Tk5IVTlMRy12S0RPcHl6SW9pZlF2U1FVbEZHOWJqc0lHZjVrTVhUeS1jNFU3dUlUSkHSAYoBQVVfeXFMUDg1YmdpaDZxUGtRS2xuRFJ4UWUwTVZiUWZfTnI3Snp6UWM1NkEyeWFpanBJUFRjNFV6RXpCR1B2UzVtandHZUhoempvN2l2VzVvaThXbDVrOU5OSFU5TEctdktET3B5eklvaWZRdlNRVWxGRzlianNJR2Y1a01YVHktYzRVN3VJVEpB?oc=5,MW,Energy firm acquires 200-MW wind project SunStar Publishing Inc.
2026-06-24 18:16,Vivant acquires 200-MW Northern Samar wind park - Inquirer.net,https://news.google.com/rss/articles/CBMijAFBVV95cUxQWnlLYzh6VXUzRmI3T0RsUWxIUFVSXzFJVURoRVR6eEVGNnVDUDBZOUJmUWpEbW05aGF6VWFoUU5rQjV3RkZKalU4enZSektUTV96am5ONS1ROUZkYkV3bnJ3bVNIclJYbmoyWTFla0dORUN2cFN4bVZISkxoWVVMMmdRQ2s4XzZUUk5ZY9IBkgFBVV95cUxOWUVPT0xaOHoyVVVscnFYQ2piMHAyUGNoSDR2amplWXBSUlhsMXo5VWNNanRBLUc5YkNGMHFvd2JTNVd0TkxTVkxZTXMwWUpMMUFpdFdjbnNVQUQzZWFrdEJEZWhRTDJuS09vYjBFajJkbld6ZEtZNnlibVBGNi1aMWtJeWRpV1dwNUEwbjFZb3M0dw?oc=5,MW,Vivant acquires 200-MW Northern Samar wind park Inquirer.net
2026-06-25 07:21,Copenhagen Infrastructure Partners reaches financial close on 392 MW Pestera II wind farm in Romania - Windtech International,https://news.google.com/rss/articles/CBMi9AFBVV95cUxNYmpBOHBiUE9TYVpNTWVRSzFxRUs5WnMtb2d4dE5UNWk5VTA5dmRUaWNLb0U1UGJESEJJSmpIcHZnVy1uTFNoSy1SM3VSSWZzbmRDcHlsNFE2bVdldHB1NHhaTXU1aEpIVE5HbExyek9wTnhiUVdWODlNYndDR2hwVjZHcUhCLUoxWXRkdWw5WXVuMHBvbVY4YU03ejU4Y0FDdjE1X2FOUlplOUQ4MGRvUzJhcG0tUWRGUm1abVRzaml1dGFhcFNKSnNCZFl2TDdIQVRfUWFKcUZlR09jNFlEZmVtQ2h4X1N2dGVOTGtFcXFEMW9s?oc=5,MW,Copenhagen Infrastructure Partners reaches financial close on 392 MW Pestera II wind farm in Romania Windtech International
2026-06-25 10:00,CIP reaches financial close on Pestera II onshore wind farm - Energy Global,https://news.google.com/rss/articles/CBMipgFBVV95cUxNOFhzYWJTaXNKeDgyUzFZcDRXTmlUNGNiNllNSWhnU1lvSmZBSXVYeHE3c21iTXdXWVd3ekM5eC1sNzMwZENXdWx0MXdEYlNWV2M4c19EODR1RXlKRmJpVDZwT1QzaFNIaWluVXJuY1B2VWhEVVZwdE83clhvbVRWT1p0ekVtd2p6N0t5eHdROUZnTzVfOFJ6UDg0R3pEcXVlRjZpU3FB?oc=5,onshore,CIP reaches financial close on Pestera II onshore wind farm Energy Global
2026-06-25 08:33,CIP reaches financial close on Peștera 2 onshore wind project in Romania - Balkan Green Energy News,https://news.google.com/rss/articles/CBMiqwFBVV95cUxNeUxuRGJHU2VsX2RHakdQMTdwN05ZOUEyWDBaWXU3M2l5bzgybDdJQWQyaG5TYUtmREE4Y0RBUk1nRDRkLVVBOEV5b2drbGRzNTlPdTY1YWpUa2R6blozaGk5TWI3LUFudGhrVG94cHhIZ3pMYllHdTRyUWNDX1JIbm41Zk9QUWVaSFJ0Z1J6cHV2SzN4SUp2cXZxak5iT1JfLVJxTV82Nnh3alE?oc=5,onshore,CIP reaches financial close on Peștera 2 onshore wind project in Romania Balkan Green Energy News
2026-06-25 06:00,Copenhagen Infrastructure Partners reaches financial close on Pestera II onshore wind farm in Romania - The Globe and Mail,https://news.google.com/rss/articles/CBMilgJBVV95cUxPb3pBeFJJWGU0djJ4aENtbWs1OG91VG1tVktGZFFFSV9ma3psalUzTnZQakhYYmZHdlVkdmNZUzI1dWFCMjJZdGRfaDRpNkZUME0wTnhwOVg1X2VPd1Y3YW9HQlYzX2dtT0w0TTFWVnJ0Y205VnBsMHZ2ZkJBTkNpYmRMUF9sV1NrZW9QVGpiTy1MTXdOQy0xTXZxTW5BZ1E3MmMzU0VIbDdZS1RSTU1ubURjVkQ5bk03N1dhSEpDLVFuR3FuSzJCQVVaS1FBUTRmVWkxMUlKcVlKSFBqV0JodjRhM1pCeXY1RGVrNzVVOHhfZ1ZGRTRNUEtkNjN1clc2SE4tVEN3elU4TktwWVZxNTRhdHl5Zw?oc=5,onshore,Copenhagen Infrastructure Partners reaches financial close on Pestera II onshore wind farm in Romania The Globe and Mail
2026-06-24 19:43,Egypt signs MoU with China’s SANY for 4GW wind turbine and energy project - ZAWYA,https://news.google.com/rss/articles/CBMiwgFBVV95cUxPdnF4aDgyTkVaUTlmemlCMUJaXzUzbkpSTFNySGlFNVhMSXhWSko5TGlmWVZTd1Z2R1NZY2J5OXlFZEU0VzVhaTVsSVV3T3JPWG1jQVJMQnk0Y1prS1kzNlE2X1NySllrZmNXY3dEcmhPakJfaERMdTJuQmRBTW9JaGxzWWtoNFBaS1htNUdMX3hjNmZUU0dLYlA1NnBvWHpvZjlWanhDWEJ2aVpzdVRuSU9wWXZIeEU3UE01TGVQUlBuUQ?oc=5,turbine,Egypt signs MoU with China’s SANY for 4GW wind turbine and energy project ZAWYA
2026-06-25 08:11,"Suzlon bags wind turbine, EPC order for 400-MW project in Andhra Pradesh - Renewables Now",https://news.google.com/rss/articles/CBMisAFBVV95cUxPOGtseFRGMGlDX3J5MVV5dGV1eUZFVnRkSVJwZWNZRGZrRlBVaExxWXZsM2hmb3RvUGhPVVJRbEQ0cm55Q1VHMVZqWTNKdXRvdzhqOW9lbVVGZER1QUhxdVBfRGZYUm1uOER6Z0VyZHhWemhnSklqUk5EUFZVeE5TZktjOXhqTWdpeGI0WHBuMlJfWmJGdzBuX25MTktKdEIyb2RzTDNQdGRDNVJQbkZqYw?oc=5,"order, MW, turbine","Suzlon bags wind turbine, EPC order for 400-MW project in Andhra Pradesh Renewables Now"
2026-06-25 09:14,Suzlon bags 400MW Tata onshore deal - reNEWS,https://news.google.com/rss/articles/CBMiggFBVV95cUxOOXRnTTJ6YTR0YWRNdFNPSmZMLVRKQkRoX2xpRjlFUVRkdWsxU3doQW5idW5kQ3l1S3EzdmswM2NFbEVyM3Z4LWdPQThFWHZnaElneWdkck0wVVplMXR3OFZJUHIwVEZUbk5vVTEwbnpMSWt6N0NuZ2dMSk51N1AwMUJB?oc=5,onshore,Suzlon bags 400MW Tata onshore deal reNEWS
2026-06-25 05:46,Suzlon Energy Gets EPC Contract For 400 MW Wind Energy Project - TradingView,https://news.google.com/rss/articles/CBMizAFBVV95cUxQVXpOZ3RuNGJsZURmQjhKMEhTbHhLUHh1eEMzMldIUnpxZXVkNW1RQXhZM3ZydGw0RFFwQThVZzlHVG0wSHlYaDVsTjZuaE9QZmJabU1BaWZNVVUxc0pJTGpuZ0hDRTkwWHNGR05yLXUyMFFtMW1tVXI1VzdteGNkVDEwMloyWHRfWUtmV0VvZTVPV09md1IwV0xWOTFDbWVEdnZDblJxdXFoOS00Ylh6c0ZzUzFQaUhpZElvd2lNZlY4WW9kYUNVZ082ckU?oc=5,"MW, contract",Suzlon Energy Gets EPC Contract For 400 MW Wind Energy Project TradingView
2026-06-25 10:27,"Suzlon Secures 400 MW EPC Wind Project from Tata Power, Crosses 1 GW Partnership Milestone - WindInsider",https://news.google.com/rss/articles/CBMiwwFBVV95cUxQMzQwc3ByWmd0dzhCeFZVcll0YWd6S1VTRmpNSHJJWi10NVJFdmhIWV93ajFuVGNLZW05c1VmZGkzS3hoeElDRGtIRmVNNWFiR1Z0VkpKakRvY3JmejlCd0RDTUVaOWVPNm1TV1BvbkRydVBLVXdMMHR6MTBRNm5NUGhmQjhvVEVoLVRjM2J2ekJvQjRGNV9wWVRiSUJMOXZIWEVabElZVFFhb25sbGoyRy1kZFV5MUVLT1RiOTVSS200VXPSAcgBQVVfeXFMT0ZlLW1IMHpmaU16N3g4VWpoNVREQW84bHhORVc5U1BXelBYaDhJZE1aeGZrQ0RWWEZfeFFoTGhha0E0MVlsSVJWb2NqSlVJTXBmVl9Pbi1JOXNoM08xOExWbkF3S3VXU3ZkM2N1bDFZREg4S2p3QzFxSmxZREprblM1R1FFZUduckNweTJjM1kxckpWRFNkel96N0lMczBxRUdXakF0SUVzV3hDUFJ5NU41ZkN0cXVlcU5nZnJmM004Z1VvZ2RUQm8?oc=5,"MW, GW, partnership","Suzlon Secures 400 MW EPC Wind Project from Tata Power, Crosses 1 GW Partnership Milestone WindInsider"
2026-06-25 09:47,Suzlon Bags 400 MW Wind Energy Order From Tata Power Renewable Energy For Andhra Pradesh Project - Swarajyamag,https://news.google.com/rss/articles/CBMi4AFBVV95cUxQWlNYVnM0UENDWWMtM09TbUlVNE11TG1wUi1sbjZ6Y1o4ZWwxRFRyUTFXbUViWGdpdXI1RzRqME5yMTNhb1RlcTlzSjNaQTE1N21CRVBfRV8xaVdjcXZKU2ItX2g2R2EyM1pjeE1Iem5DTXItTkVqWEpYMkNTWmF2TmlxRVk3V3RBN19lTlZEMnRDUmRhWGZoYzFMYVVqZmgzLTNndDFPZ2Z6R1NONklaTTg4MG9hQ3hORmtOYmtaZnVBZXBKX0h6aTc5aUxyNWtUUENZNENfc1lNTDlqa0JxTtIB4AFBVV95cUxQWlNYVnM0UENDWWMtM09TbUlVNE11TG1wUi1sbjZ6Y1o4ZWwxRFRyUTFXbUViWGdpdXI1RzRqME5yMTNhb1RlcTlzSjNaQTE1N21CRVBfRV8xaVdjcXZKU2ItX2g2R2EyM1pjeE1Iem5DTXItTkVqWEpYMkNTWmF2TmlxRVk3V3RBN19lTlZEMnRDUmRhWGZoYzFMYVVqZmgzLTNndDFPZ2Z6R1NONklaTTg4MG9hQ3hORmtOYmtaZnVBZXBKX0h6aTc5aUxyNWtUUENZNENfc1lNTDlqa0JxTg?oc=5,"order, MW",Suzlon Bags 400 MW Wind Energy Order From Tata Power Renewable Energy For Andhra Pradesh Project Swarajyamag
2026-06-25 07:21,Suzlon bags 400 MW wind EPC order from Tata Power Renewable - ET EnergyWorld,https://news.google.com/rss/articles/CBMi1wFBVV95cUxPRnlSY1dlMkZaZU5aLUl0THN2WGZJZWtQejFLb1NtdjJHb1BaaFVPdF9jU0lNR2YtUkM0aTQwaXZ4NzlVblhXbGtqNUJ5VVplOEIwOV9CQkJEZm03X2k0OGxXMmdhMm9aUnF2V1Z2cTBOWnYwNTVKVmxzQ2RreG03V2Z4WU4zU0FHSmxveENXczZ4VDBVRVpIUklzSFFUNzl4RG9NY1VwQjRMdUlhdHNHSDByNGdGYkxaOHE5RHBMNjE5TnZDOXBqT3R2OG5nUmR0dTJaaEhHONIB3AFBVV95cUxNcXZlOFRnaGlaak12aHF3OFdLaDE3N0o4QzJXMUFTbjJJQVdMdlFwV05qN1BFQzJCRGJkUmpQaHVKVFY1bVV2QVdhWktscmhlSnM5UVg2UjhMdkNvZ1JsWmxNZEhLNUtiWGZuaURYR3l3Tl9TQzhjOVJGdzBxYXdpWlVvNmFTQlZHQU13bW4tc3pjS3lGWndtTDRER05sSVp4eW1GajdaYlMyNzNORlVPMHk4VW02elp4MUZiallqUDRaeTNZM0E1VnN5LUxjbUZtdHBocnNhSm1LdVpv?oc=5,"order, MW",Suzlon bags 400 MW wind EPC order from Tata Power Renewable ET EnergyWorld
2026-06-25 08:06,Suzlon Crosses 1 GW Partnership With Tata Power Following DevCo Led 400 MW Wind EPC Order - Saur Energy,https://news.google.com/rss/articles/CBMi2wFBVV95cUxQM1FtSzJ6X3NRaTZiaklwV1R1YXk5c19CdmhWeUNjVnRfZ3QzZlFZWmZDajRkaGJIZGJKUUlRYWQ1VHBnSEhYSVNjTDVwVGItR2xXd2tTWGtEcDhkY1ZQcXNxZ3pSUld1YktjSDBERG5CTVpPRHQ0aUo4VHY0ZUNJY0EtUXp2V2xwaFBvRXQ2ajVVOTlRRmZ4dTdLQ25iTjBBMVpOSmtVeUwySFlWdTdDM1dRSndXZWdZOW0yeUI5c0xlRFpkZmFaY29icjVjMDF1T1FyZU43SnNZYXM?oc=5,"order, MW, GW, partnership",Suzlon Crosses 1 GW Partnership With Tata Power Following DevCo Led 400 MW Wind EPC Order Saur Energy
2026-06-25 06:41,Suzlon Wins 400 MW EPC Wind Energy Contract from Tata Power Renewable Energy - Energetica India Magazine,https://news.google.com/rss/articles/CBMitAFBVV95cUxOTW1pc1RQZUIwTS1UcnlaakVNWVhyZDA2Ulk2QWNtek9hR29aTm5NYXpjdWlEYlVwR1JvU0RwUlZTRlppOGNsOHFtbms2bXJZRkI2ajJXcnZNRnJndGhpRXRXQ0tPQUV1VzIza1ctZFZfUXVvQVdONG5WYUtpM0M4N1VkNzZKZld0eGdfbzhsV1R2TDNldmtQZlF5dHVpLUFIX2lBemZMQWszbU9GaGl5NUQtS3M?oc=5,"MW, contract",Suzlon Wins 400 MW EPC Wind Energy Contract from Tata Power Renewable Energy Energetica India Magazine
2026-06-25 08:47,"Suzlon wins 400 MW Tata Power order, crosses 1 GW partnership milestone - domain-b.com",https://news.google.com/rss/articles/CBMinAFBVV95cUxNUzc2MXRGNTR5cnNMRG1ENlVkUXpHQkNUM1hMektvSDZqOVlJSTM5Q1VmUFJDRDRPTjhSN1U5S01DamNDSVo0YzlNblRYeW5wY05WSF9NZmpXVG9iYkExVTZ1OW5XbFZxV2V2Vm5sQWt6TU1tMndlb2lwa3ZlWUtTMzNUdHhmQjRka0tnMDVLeUxhY3paTkVjeUd4OFjSAZwBQVVfeXFMTVM3NjF0RjU0eXJzTERtRDZVZFF6R0JDVDNYTHpLb0g2ajlZSUkzOUNVZlBSQ0Q0T044UjdVOUtNQ2pjQ0laNGM5TW5UWHlucGNOVkhfTWZqV1RvYmJBMVU2dTluV2xWcVdldlZubEFrek1NbTJ3ZW9pcGt2ZVlLUzMzVHR4ZkI0ZGtLZzA1S3lMYWN6Wk5FY3lHeDhY?oc=5,"order, MW, GW, partnership","Suzlon wins 400 MW Tata Power order, crosses 1 GW partnership milestone domain-b.com"
2026-06-25 07:34,Suzlon wins 400-MW wind energy order from Tata Power subsidiary - T&D India,https://news.google.com/rss/articles/CBMikwFBVV95cUxNQXFaQWs5TFlPbm13dEpid2VraU0zM0gxTXNkMFVYd0RrZTVlODZfQVF6RU1hLV9OdElha1JvMHF4cDI4VXk0U3NqOGI1YkN1dXYtQUpoQ2pXUHB5WldTMXhaeTNIbWNPVHFlZ2dCR0IwYXExOUttQ1llZ3lLRXBHV1MzYTg0T3ZGNFZ6UUdwNGM0SFHSAZgBQVVfeXFMUHViNTNqeWRla1VYSUd3UDdJMUVWc255Q0cteDhPME1iUldaZEhuV0VESzJ1MHFaemtoOEhJenh2S095VzdNZVE4SXRkLXRraEhBdkcwN09qSEFZWEc5d1AxNERtdHctcEFhR2tXTEtfVUU4a2laU3BPWmNya3AtLTlzQzEwVUYwX2MxY3cza3hxMzlJX2RwT1M?oc=5,"order, MW",Suzlon wins 400-MW wind energy order from Tata Power subsidiary T&D India
2026-06-25 12:53,Suzlon hits 1 GW partnership mark with Tata Power - Manufacturing Today India,https://news.google.com/rss/articles/CBMid0FVX3lxTE5WWE9Na2dTMEhRZG5TN3J0aUtWOXl5bWh3ZEpuQmo1Q1J0cWFELTlXamUwOENienZPaXJFTEpzbkEwWWhqLW15aFlqX3dlUXVnUnZVMEcyXzhNbVpuVjN5WEZQdXZqM25PRTctcEZvMlJfcTM3ajZJ?oc=5,"GW, partnership",Suzlon hits 1 GW partnership mark with Tata Power Manufacturing Today India
2026-06-25 12:18,Suzlon Energy Bags 400 MW Wind EPC Order in Andhra Pradesh - Mercomindia.com,https://news.google.com/rss/articles/CBMijwFBVV95cUxQV3BDTHl5Y0dBUkIyQW44a2VTd2tPMlVyTmVSY1RpZ1JteUJpTFd3RFJjM1Jsc25weVZvSTIwYkZUZURzLXh2Y1hNNVFvcW1tZzBTTWdYTzBfYlhOUHRsWmJWb1Vnby14cDRGdVAtNlJvZ3p6NWFWeU9FZ1B2VnhzTC00X2VzWWNCalh6eHp4TQ?oc=5,"order, MW",Suzlon Energy Bags 400 MW Wind EPC Order in Andhra Pradesh Mercomindia.com
2026-06-25 07:32,Suzlon bags 400 MW wind energy project order from Tata Power in Andhra Pradesh - BusinessLine,https://news.google.com/rss/articles/CBMi3gFBVV95cUxPdjdDdWt0a0NiUVotT1YwT1g1eG1rb3F5WjdkaFhMZG1uOWtkTHBaUGxBdjVvWkhwa0M0ZU56MjhuQ0RjYU1QQ0taMWhpZkxMMENtSW9qdEhJQzVreHJReWhXZ0ZlZ3hXUHZCeUVPV3VxeWpsdG1hak1iQkFocHFlVXlqWWJJN2hzMGFkOS1Gd2tFWTdLcXRCZjlac005Y0NXQmxUR2FlVEtlSjNucDlGZncwd2IxSnV4Y3JzbFF5ZGI4c09BNDRtQVpvT0hRTzVCbEhlWG9aVnJES0R6SlHSAeQBQVVfeXFMTXZXMUh4VDQtOUx5cVV6UkVuR0dpQXFLYjRlekpfSEtsaWFPM3dVRmVwaGFueEUzRWIxMF96SDkyZWttM0tKeWJCT0Q5Q2xvTW5Mell6TGZEUUU5bXNock9jajdJbFNrWHE5OWZXUW9TNXZuQmNLekRKN2R5Y3dMblFkNDFDWWZLY0Z5bHNrU0ZFQ2dKYVhJTWpUY0VyeXpvTkNUWGJIU2hfRGdXaXJLTmhWOEZnM2M4aDd3cXgtNDBWLTZIbkVXeWdlVHZ3UWt0MndXWjNVeVY2OGk1Z01GTnZ5N3dJ?oc=5,"order, MW",Suzlon bags 400 MW wind energy project order from Tata Power in Andhra Pradesh BusinessLine
