Date,Article Name,Article Source,Key Phrases,Summary
2026-07-06 23:01,UK freezes maximum price it will pay in next offshore wind auction - rivieramm.com,https://news.google.com/rss/articles/CBMizAFBVV95cUxPV0UxSHU5QUllNUtHS3BoVkZkZ0pVT3BqaUl0ckdrNWFHR3laYVZDMy1NSXZOSGtHdHRiQnRJUHdTdWprd1VQdXRvVHpCVkF3RTZsNk5PQV9MMlZaNVZuTmtnNjU2NjJhVm1OV0J3M01NLXdRcWZ3WFhFSjFodjRvbmJZdHEwYi1reUxOWmd1R0NxdGo1c29yaHotLW1jdmRHZWg0WlREMWxhb1dlZ0htUmUwTVdtOENIM3AzY3hBWFVhSXdUZElHUDVhcGs?oc=5,offshore,UK freezes maximum price it will pay in next offshore wind auction rivieramm.com
2026-07-07 10:37,Offshore wind wake effect sparks legal clash in the UK - Splash247,https://news.google.com/rss/articles/CBMigwFBVV95cUxOUkxIVUZTdHdJRjJ1YmJDT1ZPTm01TmVHa0RNMWp0TGVJYjREc3RtaDFCZHdjLVMtaDc2YXNVTkpTOFhPMVVYbVVqZDYzODhmdTQ2WFNfX3FFdjBqeHVDbTBJOURSTm5ZT0lrN1NKLVYxUnVrNm0zQUdhZHdlSDVQUzg4Zw?oc=5,offshore,Offshore wind wake effect sparks legal clash in the UK Splash247
2026-07-07 11:11,Legal Challenge Over Wake Effect Threatens Dogger Bank South Offshore Wind Farm - News and Statistics - IndexBox,https://news.google.com/rss/articles/CBMixgFBVV95cUxNdk5QMTN6R1ZVZGV0bkgwY3RXRHR6RnlESGtYN2xCMHZ0UVYtQUpqS290YTV0b2pMQk9aT08tYTRPMDJMaDQtQl92V3ZMd0h4bFVxLTRoWmZrNUF1aDd5R0dZNXdmR01EaHR3V2lvTnFIamhpeEVKVUJSUEU1dHdCWU1FbTJBbEZuRi1lcnF6cjNsVkcyMzNlV1BSbTctcGVlb1ZrRlFNYTV0YW1CdDBUa2syZVktSzc0S0lMeHdJQUpxcU8tMVE?oc=5,offshore,Legal Challenge Over Wake Effect Threatens Dogger Bank South Offshore Wind Farm - News and Statistics IndexBox
2026-07-07 09:43,Canada Nickel and RWE: Low-Carbon Steel Partnership Explained - Discovery Alert,https://news.google.com/rss/articles/CBMiigFBVV95cUxQcGlwaC1ocDdCdGFxdDk4Y25VQTBvanhnSXotSHVXbHV2ZjJraEU3b1dNVF94aEoySU5tYWZiZ2N4ZVdJWTc2RV9USzBvXzdmX1BCenlHM3VfYWVtNnYwZEx5UExad0p1MnJZUkl6Y0RiaGEtSzJqM25WajBaRlNleEZZMkNVR184RHc?oc=5,partnership,Canada Nickel and RWE: Low-Carbon Steel Partnership Explained Discovery Alert
2026-07-07 11:12,Industry veteran Cole to lead deepwater offshore wind tech company Neretek - Wind Power Monthly,https://news.google.com/rss/articles/CBMivAFBVV95cUxNRVRiVFZsS0lwc1BlNjZaeV9ZR2ljUi1iLWR5RFc2dWdNR3VEQ05DWG1NN3dOZWZvZWx4cS0tV3lkU1BvekZ2U0V3NW5CZmFfZHlPbEN0QU5Mbk1KODBvNGswdFE0clZQRmFtX0NsNjB3c1lydVZYaTlDaEE5WUdybERhTzBITjVrYWlubnhYR0FYekhobG4yRFphOEloYTFGcm85X0hxVkh1emxNdlhFelA0c1lUUlpZaEdYRQ?oc=5,offshore,Industry veteran Cole to lead deepwater offshore wind tech company Neretek Wind Power Monthly
2026-07-07 14:04,Community raises concerns over battery energy storage facility in northeast South Dakota - SDPB,https://news.google.com/rss/articles/CBMizAFBVV95cUxPVl9lNjdLbEdaOV9nckpmOEkySGFjTHYzRk9ZZWdBbXFjWnVsOG1ISEZ0eVo5VENGY01jbm1EXzZmY2JRQ2k4bjB4MHI2LVVITXFVOXRVb3dvcHFTS0JmUWdCUVF6RzFvSk5XVW03T2xhcEt0RkFfY0hUUnhSZlhBa1NuQWZCU3VuT0t2VlM5QnYzWjNCblhXelF6YnFWV0tWNXFSLXlnVXRuNTEtRXluM190ckZJYThqRDVrSi15ZU1xR25XQW1aOWFBZEk?oc=5,facility,Community raises concerns over battery energy storage facility in northeast South Dakota SDPB
2026-07-07 08:52,Equinor Awards Over $600M in Contracts for Four Subsea Projects - Offshore Engineer Magazine,https://news.google.com/rss/articles/CBMipwFBVV95cUxQR1RXNUJnN055WU1GclBrenNFOGVueXRrbm5WYU05RkRhV05xMGZZT2dDY1FjSGpkQUFmT3B5US1iU3E3RTkyUDZadUFGcDdUVjM2d3VHYmxSYUpVUWpCRDFaTmdsVDJGMFI3M2dYcDVEektNbVc2b0dPRkg1bDVRY21FQ3pUSVNkZTRMZ2VyRzlmVVl2YlNwZERuUUNGWU01ekVSZFl4QQ?oc=5,offshore,Equinor Awards Over $600M in Contracts for Four Subsea Projects Offshore Engineer Magazine
2026-07-08 13:08,Vestas completes turbine installation at 420-MW S Africa wind cluster - Renewables Now,https://news.google.com/rss/articles/CBMirgFBVV95cUxOWFBHYVJOREVwYUNJYVNoVmVUeS13UHE1SnZjZl9WNW8xWU1nRjBCUEQwdkVIdzZNWGROYXA4a0ltSlVlcGt4aGRQZDZ0SUVmSkU2Rm1hdkp5cl9HMnNpaWFWalJwTXIwSFdtSkJWaWVYV2dSMkNKTXMtdnZHeEZneHkxd1NkS1kwZ1A2blI4ZXRpMjlMYUUtLW5yZmIzYjFGZ21ZWE1aMFloZ29FUlE?oc=5,"MW, turbine",Vestas completes turbine installation at 420-MW S Africa wind cluster Renewables Now
2026-07-08 13:10,The Hornsea 3 offshore wind farm - Ørsted bets on higher UK renewable output - AD HOC NEWS,https://news.google.com/rss/articles/CBMixgFBVV95cUxQR1g2ekpMYjlFWGRpbF9RdE1mZmNLS003dVNVQW9FNDgtRW94WlhJN2lnRkdVbHdQTGdTc2dySndvSjVncDdzVHMtcUVpT2J5LWJLVjJwRDc4Q3pUTlpQbWRadWpzLUYzZHlqVzBkSFZibWEyOGxBQ0pBTjhvR3gyUUctQ1UtMHloaHZUdEg4Y3BpeDVfenpRajVTUjFvbkFzZW1UQlBHVXAxNG5kWjRzcnpoQVFCQjRfUUYwRWxpU2lvRnR3VUE?oc=5,offshore,The Hornsea 3 offshore wind farm - Ørsted bets on higher UK renewable output AD HOC NEWS
2026-07-08 11:57,Envision to supply 140.6-MWh battery tech for ju:niz in Germany - Renewables Now,https://news.google.com/rss/articles/CBMipAFBVV95cUxNUnZmNTJlYVpvUlNDXzJSSzZiZGg3dHd0UlA5dm1PcjkycFl2V1VHZzZUVDQ1ckhIUHJ2aHQ0NnBsVnQwR3JObUpuSC1Gckxyb0xVX0JJaGJxcWlLNzhTZ0FiQU9XVHNBN3UyTXBZbWVFb1lKeDJfSWVQWFg3ZExmbWZlek5ieXdwQ21zN2wzVVhsWmVzX3B1LUNxUVhFbXlzZ3Fscw?oc=5,supply,Envision to supply 140.6-MWh battery tech for ju:niz in Germany Renewables Now
2026-07-07 16:05,Envision Energy and Pulse Clean Energy Sign 310 MWh BESS Partnership - energynews.pro,https://news.google.com/rss/articles/CBMimgFBVV95cUxNQVBza01GLUFlQmo3SjhNcjI4YVF3bTBRWmdZRS1xLXJQcDJ3TkZ4cUFoYWlMYlR5NFZJMnBWbkpqbjEtdHhCaUQ4WnE0ZUY5Wk81TjR0eThtcm5POWtTOEp2WjRDNkE2ZU9UR21EMFBJNXhVLTBia2JSUV95NWhLMDdMUzVtaXhIOTd0OHlRNzNBR1VXbzFhRE1B?oc=5,partnership,Envision Energy and Pulse Clean Energy Sign 310 MWh BESS Partnership energynews.pro
2026-07-07 16:12,Envision Energy and Pulse Clean Energy Partner on 129 MW BESS Project in Wolverhampton - IndexBox,https://news.google.com/rss/articles/CBMitwFBVV95cUxNSlhneERZVUkxYkQySWdZTEVpMjRqZV9ZOWNiakR4b1RubS1ocFRaaGZfaW9ILU1sMlBBZmhlakJOS1pUeHpTXzVSYV9VVTNpZm9fbTlwa2JlelAxN1I3WEpMNUs0aU9JNHdYUDR6ZGZrXzcxMmJCUTJ2Ui1YVjRjT2ZXYXNjNWZWU1A0Zk0wVW0xRXFjTjg1ZEsteUtrLU5IOXVvTm1DR01GMDJ0RFVsNkt5aUdid2c?oc=5,MW,Envision Energy and Pulse Clean Energy Partner on 129 MW BESS Project in Wolverhampton IndexBox
2026-07-07 23:56,Nordex Group receives orders for 30 wind turbines totaling over 197 MW from ENOVA and BMR in Germany - Energies Media,https://news.google.com/rss/articles/CBMid0FVX3lxTE9tNUVVbEpxZ1BXN3ZHT2xHRjRNYU4wcURMSWhvWlMtWlJSR3NGWjhSdHpLcFhXbU80NjNJSGxJQTBJZVlPeXdhbktBejJPSzNSWXJINGFVU2d1N1Jya3Zla1Jqb3NJbG9aQW5fVHExR194SjJLeVZ3?oc=5,"orders, MW",Nordex Group receives orders for 30 wind turbines totaling over 197 MW from ENOVA and BMR in Germany Energies Media
2026-07-08 07:15,NTPC Green Energy Commissions First 50.4 MW Phase Of Vanki Wind Project In Gujarat - WindInsider,https://news.google.com/rss/articles/CBMiugFBVV95cUxQQ2wzRjlCLTZ4bW9ZQzg3OHRidUkxSW5sMkdqVzlENEw4UmFHaFVFVlFKWXV2aDlqM3F0czE3ODNpNWIxLU1qZUx2bW52THBsZF9qSV8tSVdfdkk5cFZzdzZhOXRBdjNNNWR3aWIycWhGd1IyY1VKaXlXMjlsTU0yYjVTN0NyaGFwX01XendCX19JSm52U1N6c1FBODlXdWtXOHQ3SU53YUNac00zMmJHbHRlMXVXNjkyX2fSAb8BQVVfeXFMTzBaaV9wTTJWS29WVXNGMnFDdVFaLWRMOHZhRWJEX29lSlZCSHdfTWIzbFViVXpjcGhDelM5MVR3YmtiRmdPcTJucTdZelFzMWJmTDFsaHVIakxZN3dISGEtSk9kTWI4algzS2p5YjhfcV9WSWl1UUt4LVllWnlpN2FRZkNTcGhwSHM4SmdrZkx1ZGpqbklFVExnWEwyNE55aG85S19ScXRVQWlXNG9fN1IyWXBnUlBObkRCRHRHUzA?oc=5,MW,NTPC Green Energy Commissions First 50.4 MW Phase Of Vanki Wind Project In Gujarat WindInsider
2026-07-07 21:42,Qualitas Energy Completes Commissioning Of 33.6 Mw Wind Farm In Germany - megaproject.com,https://news.google.com/rss/articles/CBMisAFBVV95cUxNa3hnQlJocVYyQjBTTE1XUG5YWVA5b0dnZmE2cWdwcHVYZTR2RjNtY1E4TE5PUlItaGZITnl2RUdEVzVnMDkwdnM1QzZydkt4Q0JmempUWnJ3QlpEMzVCaVFuVG1ET1RoTmxlQklmMTdIQ2poamJMQ2o4Tl92MkFiaUxQdzhoRFkzVkxnOWNPek1sSk9SR1VnZFJYdnVva1RqNndIdEIyZVNkQkNKQ0V0Xw?oc=5,MW,Qualitas Energy Completes Commissioning Of 33.6 Mw Wind Farm In Germany megaproject.com
2026-07-08 12:32,Ørsted says Offshore Wind remains cost competitive despite system costs - 4C Offshore,https://news.google.com/rss/articles/CBMiuAFBVV95cUxNQVZ3bnRteEFCR1dFbk1zVzJyMTNBbHZaamtYY1E3enNxcDN0LVZfam0ydU1keEVFZmtlUVh2a2dhcEZMZkhreGNHdHl4eGtjMUNGSXM3MkxrQnpLLVhxbFVCZWttME52Ml9rZE1oN1lxV0lOWW43MHRjSDhBMDdlZHRjRG1icGRHZmhOQk5BR0pzYTFXWk9NNW1fNEVUN0F2Z1k4c3B3SXFmVkt5VmduVUppOWNsUlN5?oc=5,offshore,Ørsted says Offshore Wind remains cost competitive despite system costs 4C Offshore
2026-07-08 04:36,Mapped | Every offshore wind project competing in next UK auction - Recharge News,https://news.google.com/rss/articles/CBMiywFBVV95cUxPV0NkZVVxZFhid2tZZE9DYzgyWWNaZjhzazlpT0xCd19oOWZBdjh0NGx2VU84OEFUVW9vaUcxYzAwZmh5SlpBbHVWUk1LYktTcGFuMWgyWmlfaVFqUTdxWjZRaFVKbWlWTmJIZEhSUVlNaHp1N1M4ejZLb01DeFZKVkxKTXhuV3V3YjlDM0EybGo4OFN0OFZsZmRwZlJqTFVDYjhJdG1VRW5PdXEzX3JTRW1JWTZvcmU0SkxpU1N2SklKSVNiTGY3UzJRZw?oc=5,offshore,Mapped | Every offshore wind project competing in next UK auction Recharge News
2026-07-08 05:58,RWE Eemshaven Onshore Wind Farm - Utility-scale renewable output powers Europe - AD HOC NEWS,https://news.google.com/rss/articles/CBMixwFBVV95cUxOR25MdHl0Wkk2Y0o3U0hUSFNubC1qVzZLOGlIMUVPcEZjSVVyMF9hZ2lmNGdHLS14cUdmbUgxZExwTFF1azJReW1FLTlsb2l5Q1BpRUE0RmNtdm5RMks0YXVwSE5FNXhweW5sLVM0dDVUQVVvMWtjUnF0aktpaGx2azRVenoybmo2aE1XZ1NiUDIwMlg5QVNGOS1WUTZGdEVIeUxZWDZVeG1BM2VYbWlKcXNmQjRrb05WWG01OF9tcllpSnNjNHBJ?oc=5,onshore,RWE Eemshaven Onshore Wind Farm - Utility-scale renewable output powers Europe AD HOC NEWS
2026-07-08 04:00,Offshore wind project backs two popular community festivals - The Argus,https://news.google.com/rss/articles/CBMinAFBVV95cUxOUVlnNEx2a0hnckVsOFRVOFRBRmE0cHZIUEI1VHQyOW05MEVPenJSMy0xcmlzUEtmS2NmVXp4Q1NBRWZDNlo2dkIxWDRnR3NJWXIwZWs2dU5qMW5sVUFJdHkxTEM2dmlEQnlZdzdPMXFQZUYxS3ZXVm41LUk5Tk1PT0lvTFlWTmk5a3cyWHVxTDEycmQyTzFkWDVYVVE?oc=5,offshore,Offshore wind project backs two popular community festivals The Argus
2026-07-07 15:36,The Vineyard Wind 1 offshore project - Iberdrola bets on large-scale US clean power - AD HOC NEWS,https://news.google.com/rss/articles/CBMixwFBVV95cUxQU2lBQkxGa0ZrUkhJeWpsWHZWZWRITURnZkhaWFpjM2F2Rzh3bWMtTVNlakRIOVMyaFgxTU1qUW5IRU5DWkQybFNmM0NFWGN4cG0wT0dUSjU1R3FzVGZFTjRYV3BqUFdtVFR4LUZkaGNQOHBiaFN1Z3prZkhTSHdqb1V5OUo3LU5UUWpfYUJ5TmdOTzZvVldTbnVuVTMtVGFoNXcydW4tR0JLNDdtQ1RpdnJEYm1qVG5WaEdsUk5BZnhqOFVMVEVn?oc=5,offshore,The Vineyard Wind 1 offshore project - Iberdrola bets on large-scale US clean power AD HOC NEWS
2026-07-08 07:00,Statkraft to invest in 280 MW wind project in Brazil - Yahoo Finance,https://news.google.com/rss/articles/CBMijgFBVV95cUxQeWc3QWI3ZGJlb24yb0pMVEgtc1JSRE1zcGtjOFlyVzhOSG4xN3lQUC1TaExFalhkU1VHa1BOSS16b1ZnTTNRRW5xb19xUC1JRWNPTDRlNUpRS3FnQVI0UUNRaURUc3NDNDlTdTZfdDY0UkJGeWlJRUVZMXZBVEhsUG1tQnNrMnlncVRkSmRn?oc=5,MW,Statkraft to invest in 280 MW wind project in Brazil Yahoo Finance
2026-07-07 15:41,North East celebrates success for £9m offshore renewables programme - DPA Magazine,https://news.google.com/rss/articles/CBMitgFBVV95cUxPNHZZb0YxZTZXWnVDUl9RMnA0MXNWa25qQS1FeERydFpZUUJTLVZUUWd6c1BVNktuZ1hDZG5MVC1oSklkdWdqUGlNSTczcnF6cWF2MTAtQ1Q2YV9ZUlZUTVp0ZWc0akpSRFQ5NUVNYk1WX0dfS2RORHd0Q3Y1TzMxQzZrTzBPWTFNenYwcjBqR0ZrclJIMjNKQ1NRSWU3NDBEYWh5UHJfQ0VPYkZCU0cyU0VMWkNyUQ?oc=5,offshore,North East celebrates success for £9m offshore renewables programme DPA Magazine
2026-07-08 11:50,EEW to expand production of offshore wind components in South Korea - Ocean Energy Resources,https://news.google.com/rss/articles/CBMiswFBVV95cUxNVzBubWZlYzBnRHpQYktPZWtaZnA3S3AwYW1ra08tLUxIaHpkM0M3a0p2YUVLcDZfZ0tDaEFURlJwQnd2cmNrazEzM1JZQmNrYk1QLW1lRzFzbXhoekI2S3labFZURl9BQ044dGQ0eTlUa0JjLVlHLWNkaEpCLVpyLWZfOUxBV29iT2pLNWNsZThRYjZJTi14aktEQUh5X1ZaOE5FUW5EY1huZzQ1UGtoalE4OA?oc=5,offshore,EEW to expand production of offshore wind components in South Korea Ocean Energy Resources
2026-07-09 05:21,Tilt breaks ground on 288-MW Palmer Wind in S Australia - Renewables Now,https://news.google.com/rss/articles/CBMimwFBVV95cUxNNFVMQVhqNmo2ZDg3WWJjN05DMXVUNVNObzFfNktuajU0TVRsVTVZSmVHZTJVdm1TQ3d1MUtzQnI4Nkd1cVNtVnN6RVJvTnRHZGs0bU1EZXBKTndoLWdBZi1QWXRvXzdhb0dZLTBfRkJJMEVNaUZYa0VNUzlya1F1WnJBMjdQMjRYbWNaYV9Eem5wNE5Uc2tLQzNtZw?oc=5,MW,Tilt breaks ground on 288-MW Palmer Wind in S Australia Renewables Now
2026-07-09 12:30,Nordex saw a significant increase in order intake in Q2 - EnergyWatch,https://news.google.com/rss/articles/CBMia0FVX3lxTE04QklmbnkyWnhKRjNFbTZjTjctTjNuT2JRMnplV0RObmM0eG5HZzViNUdEX0kxbHVGYzdjQjNtY3hZZy0xSXdQZ1ZPRmowazczM21LRVhnVTBSU3lmaGxWdnVScEZ2Zmdrb0Fv?oc=5,order,Nordex saw a significant increase in order intake in Q2 EnergyWatch
2026-07-09 13:57,Collett completes dual blade lifter operation - reNEWS,https://news.google.com/rss/articles/CBMiigFBVV95cUxPS0ZlUW1UeC1ZaTZJSjlHU3JFRGdOdlVXdnJnY3NzbXVSY3IwaUFHaV9iZWtSWE5ZY1gxTms1cGV4RGlDc1ZNb09tai1tSDRrajdCZlVONzZLREt6UTFUbWltZEEtN2hfQzFUUWw4dV9KNGkyLTVmckIzdHo2RDlOdDduX3VmNkVFV2c?oc=5,blade,Collett completes dual blade lifter operation reNEWS
2026-07-09 12:37,Greece’s Wind Energy Capacity Tops 6 GW for First Time - tovima.com,https://news.google.com/rss/articles/CBMikwFBVV95cUxNSzI4a3dDS21xdXVFT2JvdWFIeDRrN0ZoMG1mMnVtMkVRR1ZNR0gzaG5uMzFDcnprTEtPSm03dGVGbDEzWmgtOTJUcVk4UjY4dzNKNlFfT3dPYkJTY1lIS0FoUXllVk9acFl6NllrcER6YWhwbmpzUkxmTkZlQS1CLUItMVpTOHRrRXJRZ2VjVy1ZSHPSAZMBQVVfeXFMTUsyOGt3Q0ttcXV1RU9ib3VhSHg0azdGaDBtZjJ1bTJFUUdWTUdIM2hubjMxQ3J6a0xLT0ptN3RlRmwxM1poLTkyVHFZOFI2OHczSjZRX093T2JCU2NZSEtBaFF5ZVZPWnBZejZZa3BEemFocG5qc1JMZk5GZUEtQi1CLTFaUzh0a0VyUWdlY1ctWUhz?oc=5,GW,Greece’s Wind Energy Capacity Tops 6 GW for First Time tovima.com
2026-07-08 15:55,Taiwan offshore wind projects face inflation headwinds - Nikkei Asia,https://news.google.com/rss/articles/CBMimgFBVV95cUxQLXYtd1pIemd6SU1QT2ZFM25GeGNOOXdiXzBzT2R1T0Y3SmxKUzZablh5RUtBd290bVhpUHd0eVBfb3VNRkY0OUZQZ3FGelRPb0dXai1yTFlKTzRqaU4tcFlHc1lVZTBKRUdPRHp0bk5pNy04MmpsQXRkbFRQUWNLOVU1RHZ2ajNueWo2emZ6QWJueGNtSFhtcHFn?oc=5,offshore,Taiwan offshore wind projects face inflation headwinds Nikkei Asia
2026-07-09 00:57,Kyiv Company Plans 105 MW Wind Farm in Kirovohrad Region. - ubn.news,https://news.google.com/rss/articles/CBMif0FVX3lxTE1ZXzNyX3dPTW9qZnE3U3hNTkhOUWtNaGs5NEJaWXVRRDA4R1p6ZjJrV2JycXBENHNTaDBQTm5zRW5TTUVrZ2toRU1QZF84RWk2YlAyMkRTN3dweUFzUDhUM3FTb1dvaTJ5anhaS0Z0WmZRVWg5R0t0WDh6ZVRsV1HSAYcBQVVfeXFMUHBsa25rU3NFcTRzUnBaaldKUHM3aXhuZUxJWWFTc3pfb19fekNyU0Y3SUsxaDU2ejByZnRwM2ZMREg4RnVaaG5lWDU0OWtwOW80TWItQUZvN2k3Mk92MUlvZG1Ib1FBYXZhV253YkdtcUU4QVN4ektaMS1sUkliam9BVmQ1Ump3?oc=5,MW,Kyiv Company Plans 105 MW Wind Farm in Kirovohrad Region. ubn.news
2026-07-09 09:15,Greece's wind energy capacity exceeds 6 GW - Renewables Now,https://news.google.com/rss/articles/CBMiiAFBVV95cUxNcmJxVENKTU9HR0JINVZVcEY0eFN6ZDJ1NXhBM3JNV2txYXAwYkc5aFhyZWQyd3ZFNFNqTDJtaWkwM3JYeFBLN0puRWJiejJKTVZjbjNxWld0aDI4d2FfMEFndk52YjFHQ19na092bkNOSEpUMmVoQzdBRGVWS3V1OFkya3ZWd0ZM?oc=5,GW,Greece's wind energy capacity exceeds 6 GW Renewables Now
2026-07-08 22:12,GE Vernova Hitachi and Velan sign agreement to supply reactor valves for BWRX-300 SMR projects in Europe - Energies Media,https://news.google.com/rss/articles/CBMid0FVX3lxTE11MkZYVVptcVYwSWROemJUQUJLZG9kYXJvdXZPV2lmdnc3Y29wVU15UE1vTU40WEpxY2RFcmtxMmR2MlNvZjc2d0hlSUZTTlRYeWJWWHlvSzcwTnNuSUxwa25iMUxtdk80Yk50aEdTNUlhaHh4ZC1z?oc=5,supply,GE Vernova Hitachi and Velan sign agreement to supply reactor valves for BWRX-300 SMR projects in Europe Energies Media
2026-07-09 11:30,Mingyang lands another senior hire from European wind turbine rival - Recharge News,https://news.google.com/rss/articles/CBMipAFBVV95cUxOSk8xS1Z4SVMxU2NmNW03QkhxVUUtcFktanRlN01VTUFDRGNRcGtTOUtzUzVyM1NCTEpBcWN5VkpKZEtHM1VHQms3bzFRdzJod0FBVjZaY3JvMC1DS2NHV2w3VHpVb2dPZW9JZlZUM0I1bmwxS0c3ZzU5TVdVd1RRaTJVd2s5T05temhEODBoZXNvbml6dXZqWlktbmZQck80Mkt1eA?oc=5,turbine,Mingyang lands another senior hire from European wind turbine rival Recharge News
2026-07-09 10:42,Nordex turbine orders tick up in Q2 following US boost - Wind Power Monthly,https://news.google.com/rss/articles/CBMingFBVV95cUxOanVZZ1RHZF85eGx3RkNkeWVObXNaUzZMMjBTVWtFV2ZhX2Fyc2MyekRYZjN3Tnh0V3VMUlI2Q0lmNTVZRDNTOTZESGJULS1EWG9kRmxUVXlES1FJVkRsOEgwZmdXOHhPRkxOUGZ6bncyMldjSkEzXzZGZTJRdERKbHZFU3Z0ZDRVWDkzVDNRNTRRay1jX0xqSVpBSkoxUQ?oc=5,"orders, turbine",Nordex turbine orders tick up in Q2 following US boost Wind Power Monthly
2026-07-09 08:36,"Nordex gains 4% on robust wind turbine orders, U.S. demand strength - Investing.com",https://news.google.com/rss/articles/CBMivAFBVV95cUxNc1k1Ql8yN181VlM2ek9Xd3NReUVycnlGVk50SVFTV1J2VUJ0MmxjdVJjNUJybE1XU1dNeGM3cllLODZqaG5IbkNUZ0Vjay1wQUUzLUlnb3RSY01mQ3htTWhmUEllOF9laGtXTXZDQkNxLW45RkVod09fdFNaOWRtSHRHcU1PWERwUEoxeTJ1ZDJIUVNuUHhEUmdOTEJlRzRjeGxzUllYa1pFUVRnN1B0cWpwZG5LazYzeDRpRg?oc=5,"orders, turbine","Nordex gains 4% on robust wind turbine orders, U.S. demand strength Investing.com"
2026-07-09 05:22,Nordex Q2 Orders Surge on Strong U.S. Demand for Wind Turbines - Global Banking & Finance Review,https://news.google.com/rss/articles/CBMie0FVX3lxTE9RcUU5RTFDeW40V3Y1TXVqNk9OOXJhbnRWNG9yMFp5WUN2c0luaFYzVUUwc0lHZlc5bzVYeE5uckFzT3lDV3I0R05RcktFZ21Wb3B2SEc3YV9zU3lpNTBocmEyVDBLcEswenprX1dja2g1OWhmMlBBRU1wUQ?oc=5,orders,Nordex Q2 Orders Surge on Strong U.S. Demand for Wind Turbines Global Banking & Finance Review
2026-07-09 06:54,Nordex orders jump a third as US bet pays off big in Q2 - Recharge News,https://news.google.com/rss/articles/CBMiqgFBVV95cUxQQjE1a0lEMHN2Q0VnWVNsWmIxNncwSDlHQkgxLTVvQ2s1VHc4RG41RFBTMXlWMEhsT0dOUjZ6eXR5b1NUbm9TU09iSldYV0FDaUtOQWlOdnp4cEx3RG8zZk1tazhtN3ptUWFPeG9KaTBKV0t4THptLXVPMklKNG1PeHdrbjlnSkpsLXJGM2l1Y0VFdGpuVlZCNU9QSDRxeWdidndnYWdsYk9uZw?oc=5,orders,Nordex orders jump a third as US bet pays off big in Q2 Recharge News
2026-07-09 07:16,Nordex's Q2 order intake surpasses 3 GW with stable pricing - Renewables Now,https://news.google.com/rss/articles/CBMinwFBVV95cUxPTUZyQTVrbUpoZ1IwQXJFR1Y4OWNVcjh1OGs5OFVWUTI2LU1yREJxeHg1ZGxjX1V6MUlJMXBLVkxIYnF5SlUtRHk3SGs4aGI1MzhhRzVaWHpFQnc0Z3FJNFVNaVFDRWNsY01yWGNqeHZCZXQ4eFRzQ1BHckVydkxtZHgzdUZ5Rm9BT28zSFJOMzhkSlRacnFnUVNaVDd2NTg?oc=5,"order, GW",Nordex's Q2 order intake surpasses 3 GW with stable pricing Renewables Now
2026-07-09 09:41,Nordex Secures 700 Mw Wind Turbine Orders From Uka In Germany - megaproject.com,https://news.google.com/rss/articles/CBMiowFBVV95cUxQQkdTczJXZ2RzN1ptcTJHOWQ3N3E5S3dHeGNfM05oVTFQYTN0VzJoVElXWlZ4VkdDc2FlbHBoZW96Rl9RR2ZyMFEycGc0cDdCeE5OWWcyT0Z6VDF2cEt4a3ZCZkZQNmJHaXNtVEszdXFNd3VoNHlWOHA2bmMzOUEtbUVCODJZT09YOWFub1h6d2xha1g5dTR4Q0R2aDJSS1FHSGNz?oc=5,"orders, MW, turbine",Nordex Secures 700 Mw Wind Turbine Orders From Uka In Germany megaproject.com
2026-07-09 05:00,Nordex Group announces 3.1 GW of order intake in the second quarter 2026 - TradingView,https://news.google.com/rss/articles/CBMixAFBVV95cUxNSHN0RzRNWHVuSWliNnZxdTI1NGlQbFJtZWFObndpM25XdWRFX192QXNWemc5ZFAyb1NnZlpZV0g5U1lab0YyUmc2TXI3R1NYaTlBNjFkUkNsZFJkOVpXY1VtTTNUeFh3OVJDcWVfLWxDdkVmdmQ0eVp5QmZsMW1PUEk3cmVzc3M1WkRmazN5Rkh4b1BlWFhVNWc2UVd1bmRSLXRsbnpIWXZ1U01CUFVVb0RpZXJ6TGVJeEhTemg2TGlWdy16?oc=5,"order, GW",Nordex Group announces 3.1 GW of order intake in the second quarter 2026 TradingView
2026-07-09 10:17,Nordex balances order growth and margin pressure as global wind demand shifts - Ad-hoc-news.de,https://news.google.com/rss/articles/CBMiyAFBVV95cUxOYXpCR24tTU5OYThCSXNPLXg3d3JCMm9KcUVRUkhqV05ySXlfWVZod2FmUl9YdF80TDRtNG14SThhNmtXaWhieUYzQlRBX3VIRGNqX1ZsYzhPeDc0WS1yekVpTXQzWmtxS2RzeG9reXhxYkZZMUF4SExabGZ1RjB1ZTExLVY5UkFrZ0J5Zm1yb0JOVjJTZHBRNDFZamJyNkU1bUM0Z24waWNvaTlJMlZGMG9Wb3RnVGt3TWEwTHZpTGk4X1BGUVprQw?oc=5,order,Nordex balances order growth and margin pressure as global wind demand shifts Ad-hoc-news.de
2026-07-09 03:55,KP Energy Commissions 50.4 MW Wind Project for NTPC REL with Suzlon's WTGs - Saur Energy,https://news.google.com/rss/articles/CBMixAFBVV95cUxOSnZoUUpaRERGaTdzb2stU00wWUEzZWRWWmdvU1QwcmtNbEZIR0xIdHNoTXNZa0pHZ2RCYUQ4QkJUUjduRkd0Q1FKVHhIRW9xRzlzZ1Z5ZHM3V0lhYjh2TXl6QnVhOHZkdDlncTFTTGNSMTNXdDI3d1MzTzBWOGhtSUFxU05HVU1TTmkzSEM5cGgzLTQtTWQxWFUzUE5oaXg0dVlPanB5X0NaYllmempjcGc3bkNDM2VtOVZLRUtieVgxamJj?oc=5,MW,KP Energy Commissions 50.4 MW Wind Project for NTPC REL with Suzlon's WTGs Saur Energy
2026-07-09 06:47,KP Energy Commissions 50.4 MW of Vanki Wind Project in Gujarat for NTPC Renewable Energy - Energetica India Magazine,https://news.google.com/rss/articles/CBMixAFBVV95cUxPdWZjbWRSREMtTmFON2d6OTRGaGhoQ2NBcExvRUZFMGQ5dmI5LWhwSllLSGRReTRTcWtTcVN5V2ZMZWd1SXRfWXVRV0pWTmtjejhOYURVR243NWVxUExLZEYwVVk5ZlRTakllSkFiNzBkeWVZdUMxdnZaUGJWd3hnX3B4WlJiN0JTc3NxY2NkenZ3NzI3eWtXaWh0ZmEzVTFkQ2pUS3VXNDZfbTRMZ2d3YmszNmJTUi1kV0pxRkpNYmtFekNT?oc=5,MW,KP Energy Commissions 50.4 MW of Vanki Wind Project in Gujarat for NTPC Renewable Energy Energetica India Magazine
2026-07-09 04:24,K.P. Energy shares surge 3% after commissioning 50.4 MW Wind Power Project for NTPC Renewable Energy - BusinessUpturn,https://news.google.com/rss/articles/CBMi5gFBVV95cUxOeGdoS0ZRc3c0bklSdzB3eHBiODE0N3R6ektQbzZWTWQtaGFHZlpERWljT0VrTGo1VlI1Z1VqdFhqbU1GeGJtcFpvRXZhMnRaX2wyRmhPOXVBOElDbk1KVXEyTENmOC0tYW9DWUU1d3djLU03RG8tRmRXelpBS1NrQzI5bEhWUDNkT2pPVTdzTThGelB0WElCMXNqRGl0eEhyT3o5R3drc0Q3V3Q4YjFWbWFZM2hqLUpsV1JpMHppOWU0N3EyS3lIT2k1bFI5MmF3bkRyTVd0MnpQS2s1eUhzNXZxUXBlUQ?oc=5,MW,K.P. Energy shares surge 3% after commissioning 50.4 MW Wind Power Project for NTPC Renewable Energy BusinessUpturn
2026-07-09 14:20,Ørsted have just announced a long-term PPA with Gode Wind 1 partnership - 4C Offshore,https://news.google.com/rss/articles/CBMiuAFBVV95cUxQcTVoYXNVV1BqZXphWjlDSjlzUXJBUVo5U0dObDE0a0lrWEo0V1JJVFBTOWl3bGlmRGJfaFg0RXhVTXFFSlQ5WldnTVJVSUs3ekQ0anRLbnVHem84YnNwZnhZZzVkTmN3dmJscE5uWnRfWE5XbVVCNTV4TE4zX3JIVlZoalNVMHBGOTNIVkR5anR0SkQ5WXZWU00zelJVQUVINXpkYzRIWW5rTmI2TWpzc0Q5M2FOUUlX?oc=5,"offshore, partnership",Ørsted have just announced a long-term PPA with Gode Wind 1 partnership 4C Offshore
2026-07-09 08:05,Taiwan reviews offshore wind policy - Taiwan News,https://news.google.com/rss/articles/CBMiWEFVX3lxTE81aThaU3pTMnQzV2UxeVhWZTVnSkNWamE2SDk1emYwUnJ1ZWt3ZDNXX1FEQXh5V3JiT21fcFdJb1VXRWlvQTN4MXBlU1dBTUNSRGVxVlVOQ2s?oc=5,offshore,Taiwan reviews offshore wind policy Taiwan News
2026-07-09 13:45,ACT Blade secures Senvion MM92 certification milestone - reNEWS,https://news.google.com/rss/articles/CBMijAFBVV95cUxQeWI3eG1ESGRTNUdrMjJhelJ5Y0pHR2pfNHl1Zk5zem5PNXJWTndhZUhjRlpOODF5cDU4Vzhlc2Y0ZzhYcVNCZFVNY2VnNEkyR1dXRnNwSGNDc3R4eUc3UTA2TjhlUXd3TlZhNTRONkFMV3hYdTRYZ0JRSE1EWk92REsyWGc4LTRVT1o4SA?oc=5,blade,ACT Blade secures Senvion MM92 certification milestone reNEWS
2026-07-09 10:25,Cause of Siemens Gamesa blade shipment disaster revealed - Recharge News,https://news.google.com/rss/articles/CBMivwFBVV95cUxPcXR1RmFsTXNBMVNJTmEzQU9xdFNEUExVREk0T0hvTkJkT3RjVWo1TmxnM2VXTUdaeWt0MnV3NXNrUjdZTGJJeFhieFRjQUp5SjRKVHY0Q2FqeFczcjBEXzFRbUcxYVVjRWFYQ0pYOXZNN21CS0pYOEdSYS1xZkhQMERXaWNqX2M3YzlJWXpET3p5ZmR3dHU3V3I0R0lCYXJqWnp5bWRidXdHbEI2OXFQNW9hZ2dOLTBTTURzWHRXYw?oc=5,blade,Cause of Siemens Gamesa blade shipment disaster revealed Recharge News
2026-07-09 10:07,Philippines pauses first offshore wind auction - Wind Power Monthly,https://news.google.com/rss/articles/CBMimwFBVV95cUxNQ1Fqa1VnTHMyODFlUUVsRjVLamlFeFZKU0NUelpVUlFKVGFQSU9uUG1QU2FqeTctZ0RUcXdZUmNpSjZySVpLc2Q2RjRCMU9SbnhjUE5TMUpZOUxGSGhmVVU4YkJnb2w3MFBNV21OWU9jRmhfTExCQkQ1LVZFWTJjYjhtNmpYaUlXdVBEaVNselJVUkszZnJYOE5ETQ?oc=5,offshore,Philippines pauses first offshore wind auction Wind Power Monthly
2026-07-09 12:52,Oklahoma Solar Hits 525 MW as Google-Backed PPA Model Reshapes Grid Finance - Tech Times,https://news.google.com/rss/articles/CBMixgFBVV95cUxNamR5amRkU255WTlBQmR4QzhkMjV2Ymw5OEh4Nlprbm1sWVVtOEdlQUVhSFdwcEotSGZLOVZBUXdzOV9PYXA0cmk1dUQ3WVgxUHFOdHVqRnY5OGlKMWQ0TDRlS0d3YkFueVVwNUZMdmc2bDdmcTBISjdpWGp3R2VtVUxPOHVGck5rT1htTWY1S2REd2Y1bUF4S1g1NXY5SF90b2dhOUxRNzNaNEJXXzdwNXBEa1hmTjEyYzN6LUdSQlZOdThqN0E?oc=5,MW,Oklahoma Solar Hits 525 MW as Google-Backed PPA Model Reshapes Grid Finance Tech Times
2026-07-09 11:32,BP plans withdrawal from Japanese offshore wind project - Splash247,https://news.google.com/rss/articles/CBMihAFBVV95cUxPekV2OGRsU1BRVkpwS1RYUFRHY2w4NUlqOVhteTh1ejN2NXFQRjc0c1dTTmxHVDFHZU9MSWd2TUtYVWNvWlRoR1RfNjZaRzY5YWEzWEZLaFE4Q2NtUEtMZmJ1UmoxMGdwNGVTUEM3Zm8ta3g3MFZHNUVxR2M3N0JNbUpxVWk?oc=5,offshore,BP plans withdrawal from Japanese offshore wind project Splash247
2026-07-09 10:42,Vår Energi Gets Clearance to Drill Wildcat Well in Norwegian Sea - Offshore Engineer Magazine,https://news.google.com/rss/articles/CBMipAFBVV95cUxNWGdkM091ZzJ2SzhpYURfdU43eDcwS01CN1I3N3ZBZzdmYkhrY2VqZWxHS0ttWXhsUmpPVDh6MktPRXRpNWptajBtc1B6NlZVU2l1bTlPX01wazk0Qkc5YldLa0JnelBhUHMtUVpLMVE0c0J4aVVrbW44SGpobGxqRUpzam82QTVTNnJmVVljTHlOSlF4NzRsQ1dFTDNWeXVNRjVTTA?oc=5,offshore,Vår Energi Gets Clearance to Drill Wildcat Well in Norwegian Sea Offshore Engineer Magazine
2026-07-09 11:36,Saipem Taps Fugro for CCS Development off UK - Offshore Engineer Magazine,https://news.google.com/rss/articles/CBMiigFBVV95cUxNVFd6cWFGS2xyQS1SM2Nhenp2YTZWLWw3X2ZkOVN5S1FLcE43S053X2loZkdUcko3RmVXR1Y1d0t6Y2hyODY5dkR5eWxoZXRCRGh1LWhHb3VsYnpqc0F4YmhOZTc3RlN6dnAwU0pwU05ibTdoUkpkcUxLbkFoQzg5OVpNTHRkbVBONXc?oc=5,offshore,Saipem Taps Fugro for CCS Development off UK Offshore Engineer Magazine
2026-07-10 12:19,Vestas secures financing for Japanese wind turbine factory - EnergyWatch,https://news.google.com/rss/articles/CBMia0FVX3lxTE1ZWUkyVEpSdE9FYlZuOU5zdzFyX2FGQzRHWTVzY0dmSFUwYkdRVnE0UlhQeDRMdzE2XzVjdzdGRFM2TmhNYUQ0S05XT1hySnVtbmIxYXh5TmJtbzdpUmtkVEhHanYwdUhjdkZn?oc=5,"turbine, factory",Vestas secures financing for Japanese wind turbine factory EnergyWatch
2026-07-10 07:22,Vestas snaps up 272-MW Tasmanian wind project from Ark - Renewables Now,https://news.google.com/rss/articles/CBMimgFBVV95cUxOUjQxbGtPeC1KZWxiNkl6aWRVc250cm9WZUZqZ1lIcGZhTXpqTTNFWVBIeGl4dkozMWVjQ19IOXp5QUVFSDlsX1pxcjRYYm5wVEhTb1RUM0cyb0hCSkoyVGdTVEdEOXlleTdGeGFmd1FZTFhlamhhMEVJcW5sZmdNWVFOMDhHMmEzbVAyMzN0bW5QajZFRUJPZmRR?oc=5,MW,Vestas snaps up 272-MW Tasmanian wind project from Ark Renewables Now
